{
  "id": "chem_hts_assay_validation_zprime",
  "title": "HTS assay validation: plate uniformity and Z' factor",
  "domain": "chemistry",
  "pipeline": "chem_library",
  "pipeline_steps": [
    "liquid_handling",
    "fluorescence_read"
  ],
  "summary": "NCATS Assay Guidance Manual procedure for proving an assay is screen-ready: run Max, Mid and Min control plates across several days, compute CV, signal window and Z', check drift and edge effects, then compare potencies across runs.",
  "automation_level": "manual",
  "steps": [
    {
      "order": 1,
      "text": "Choose a plate layout: interleaved Max/Mid/Min signals (three plates per day) or a dose-response-plus-uniform-signal layout.",
      "capability": "manual_bench"
    },
    {
      "order": 2,
      "text": "Run the uniformity study for 3 days for a new assay, 2 days for an assay transfer.",
      "capability": "liquid_handling",
      "duration_s": {
        "value": 259200,
        "confidence": "literature",
        "note": "3 days stated for new assays."
      }
    },
    {
      "order": 3,
      "text": "Read the plates on the intended detection platform.",
      "capability": "fluorescence_read",
      "catalog_ids": [
        "bmg_pherastar_fsx"
      ]
    },
    {
      "order": 4,
      "text": "Check CV of Max and Mid signals is 20% or less, signal window at least 2, and drift/edge effects below 20%.",
      "capability": "manual_bench"
    },
    {
      "order": 5,
      "text": "Compute Z' = 1 - 3(SD_max + SD_min)/|mean_max - mean_min| and require at least 0.4 (0.5+ preferred for HTS).",
      "capability": "manual_bench"
    },
    {
      "order": 6,
      "text": "Run a replicate-experiment study with 20-30 compounds in two independent runs; require minimum significant ratio below 3.",
      "capability": "liquid_handling"
    }
  ],
  "equipment": [
    {
      "name": "Plate reader",
      "catalog_id": "bmg_pherastar_fsx"
    }
  ],
  "materials": [
    "Control reagents (Max, Mid, Min), reference compounds"
  ],
  "safety": [],
  "source": {
    "url": "https://www.ncbi.nlm.nih.gov/sites/books/NBK83783/",
    "publisher": "NCBI Bookshelf, Assay Guidance Manual (NCATS/Eli Lilly)"
  },
  "license": "CC BY-NC-SA 3.0",
  "access": "open",
  "confidence": "literature",
  "notes": "Authors/year are from our knowledge of the chapter, not shown in the fetched text. Thresholds (Z' 0.4, MSR<3) are as stated in the chapter; pipeline text uses 0.5 as conventional. Source authors and year not recorded: they were not confirmed from the opened page.",
  "retrieved": "2026-10-04"
}
